空間性注意障害のみかた,2023-06-25,https://cir.nii.ac.jp/crid/1390296685881441024
寛骨臼に生じた広範囲のdesmoplastic fibromaによる股関節・大腿痛にパルス高周波法神経ブロックが奏功した1例,2023-06-25,https://cir.nii.ac.jp/crid/1390578050263040768
アートベース・リサーチを応用した医学科初年次の地域体験実習の実践,2023-06-25,https://cir.nii.ac.jp/crid/1390579388428987904
"医療者の ""人間性教育"" に残されている課題",2023-06-25,https://cir.nii.ac.jp/crid/1390860863405691008
神経根ブロックなど脊椎外科診療における被曝低減対策と今後の課題,2023-06-20,https://cir.nii.ac.jp/crid/1390015023061212032
批判的思考態度育成のために動画学習と質問活動を取り入れた対面授業の実践と評価,2023-06-20,https://cir.nii.ac.jp/crid/1390015333257622656
設計･工事プロセスが阻害されることで建築紛争に発展しうる事件の傾向,2023-06-20,https://cir.nii.ac.jp/crid/1390577973014199040
梨状窩瘻に対してフード付き内視鏡を用いた化学的焼灼術を行った1症例,2023-06-20,https://cir.nii.ac.jp/crid/1390577973014464384
第13章　食物依存性運動誘発アナフィラキシー（FDEIA）,2023-06-20,https://cir.nii.ac.jp/crid/1390577973014611328
作曲過程における楽器生成の可能性 --《ニーベルングの指環》の〈バストロンペーテ〉--,2023-06-20,https://cir.nii.ac.jp/crid/1390579322261307136
肺がん診療におけるAdvanced Care Planning,2023-06-20,https://cir.nii.ac.jp/crid/1390859547229976320
急性期脳損傷患者におけるBox and Block Testと食事動作の自立度の関連,2023-06-15,https://cir.nii.ac.jp/crid/1390859392520522752
「単一脳領域における賦活」および「脳内ネットワーク」の2つの視点による運動学習の脳機能変化と運動学習の遅速による脳機能変化差異の解明,2023-06-15,https://cir.nii.ac.jp/crid/1390859392520547840
ウルトラファインバブルを含むシャワーの角層水分量・保湿への影響,2023-06-14,https://cir.nii.ac.jp/crid/1390296431523251712
医学生が一般職員として勤務することの意義と転用可能性に関する考察～正統的周辺参加理論に基づく，医学生と医療機関の互恵的関係性の構築～,2023-06-10,https://cir.nii.ac.jp/crid/1390859525236794624
覆る直立二足歩行の進化史 人類が試した多様な足取り,2023-06,https://cir.nii.ac.jp/crid/1520577818297474560
無毛変異によるヒトの進化,2015-01-16,https://cir.nii.ac.jp/crid/1050564288432712192
「食べること」についての哲学的試論 : 人間と自然との関わりという観点から,2014-01-27,https://cir.nii.ac.jp/crid/1050282812571084800
火の使用，料理の発達と人類の進化（リチャード・ランガム博士へのインタビューより）,2011,https://cir.nii.ac.jp/crid/1390282680483064192
湖沼堆積物中の燃焼痕跡物として記録された後氷期の人間活動,2010,https://cir.nii.ac.jp/crid/1390001206496856576
タイムマシン『化学号』(化学への招待),1991,https://cir.nii.ac.jp/crid/1390001204310595072
高感度Amesテスト (accelerated microsuspension法) の室内空気汚染計測への適用,1989,https://cir.nii.ac.jp/crid/1390001204617194752
石油と文化,1930,https://cir.nii.ac.jp/crid/1390001204357332224
"石油と文化(通俗講演會, 第七回大會講演録(其一))",,https://cir.nii.ac.jp/crid/1543950420040345600
プログラミング言語の使用割合とソフトウェア開発の生産性との関係,2022-10-25,https://cir.nii.ac.jp/crid/1390013087508135168
中国通外交官・岩村成允(1876-1943)の情報活動 --中国語の使用という視点から--,2022-03-25,https://cir.nii.ac.jp/crid/1050010457799527680
An Investigation of Multilinguals’ Language Development,2022-03-01,https://cir.nii.ac.jp/crid/1050854718192224768
雑談における学習文脈で用いられる記憶の心的述語の会話分析的研究,2022-02-15,https://cir.nii.ac.jp/crid/1050573243654380544
記号論を視座とした算数と数学の接続に関する一考察,2021-12-19,https://cir.nii.ac.jp/crid/1390572266313358592
プログラミング言語の使用割合に基づくソフトウェア開発の生産性分析,2021-11-11,https://cir.nii.ac.jp/crid/1390292018964061696
第二言語習得のためのコミュニケーション活動における第一言語の使用について,2021-03-31,https://cir.nii.ac.jp/crid/1050287907210652032
「専門日本語教育学会と関連性が高いテーマ」とは何なのか,2020-12-31,https://cir.nii.ac.jp/crid/1390576118542571520
解読の紛らわしさ : 英日翻訳の欠点について,2020-03-31,https://cir.nii.ac.jp/crid/1390853649729735168
成人期のADHDとASDを対象としたコーチング ―Computer-Mediated Communicationに関する質的検討―,2020-02-29,https://cir.nii.ac.jp/crid/1390568949400640512
How to characterize manipulatives and gestures in different theoretical frames: Discursive instrumental and dialogic approaches in mathematics education,2020,https://cir.nii.ac.jp/crid/1391693801405996160
聴覚障害児の早期介入に関する検討:全国聴覚特別支援学校乳幼児教育相談調査,2019-06-30,https://cir.nii.ac.jp/crid/1390564238107343360
Examining the Psychometric Properties of the Groupwork Skills Questionnaire for use in the Japanese SLA Context,2019-03-25,https://cir.nii.ac.jp/crid/1050282813216113536
ドイツ語および日本語学習者のフェイスブック上での学習言語の使用について,2019-03-01,https://cir.nii.ac.jp/crid/1390572174812258816
危機管理と日本語による表現 － 航空用語（英語）との比較からの一考察 －,2019,https://cir.nii.ac.jp/crid/1390846609780101248
ベトナム人集住地域における複数言語の使用と学習に関する研究,2018-12-31,https://cir.nii.ac.jp/crid/1390564238089762560
英語学習が日本語母語話者の認知に与える影響： ボディーパーツの切り取り方をめぐって,2018-12,https://cir.nii.ac.jp/crid/1050282812994247040
中華人民共和国上海市における上海語テレビ放送と言語政策 ―ポスト標準中国語普及時代の方言放送の行方―,2018-09-30,https://cir.nii.ac.jp/crid/1050282677683796992
トランプの移民政策と言葉の（無）意味,2018-08-31,https://cir.nii.ac.jp/crid/1390860852414614528
Psychometric Adaptation of a Japanese Version of the Feelings Towards Group Work Questionnaire for Use in the Japanese SLA Context,2018-03-25,https://cir.nii.ac.jp/crid/1050282812911001600
類義表現の例文分析において言語化される例文の意味内容 : 使用される日本語表現が示唆する例文分析の傾向,2018-03-15,https://cir.nii.ac.jp/crid/1050845763857330816
類義表現の例文分析において言語化される例文の意味内容 : 使用される日本語表現が示唆する例文分析の傾向,2018-03-15,https://cir.nii.ac.jp/crid/1571980077560811392
グラフ書換え系モデル検査における差分適用グラフ同型性判定手法の導入,2018-03-13,https://cir.nii.ac.jp/crid/1050011097118277376
ニュータウンにおけるガ行子音の変化と意識 : 言語の使用と意識に関する社会言語学的研究,2018-03-01,https://cir.nii.ac.jp/crid/1390572174555949440
台湾ニューシネマにおける日本の表象,2017-09-30,https://cir.nii.ac.jp/crid/1050001202698094208
シンガポール共和国のテレビ放送に関する言語法について（2・完）―華語および漢語方言の使用に関する規定を中心として―,2016-09-30,https://cir.nii.ac.jp/crid/1050282677674749696
CLIL内容重視型教授法の特徴とその効果,2015-10-31,https://cir.nii.ac.jp/crid/1390009224749454208
シンガポール共和国のテレビ放送に関する言語法について (1)―華語および漢語方言の使用に関する規定を中心として―,2015-10-30,https://cir.nii.ac.jp/crid/1050282677692463232
ESL/EFL教室における第1言語の使用とネイティブスピーカー教師の役割,2015-03-31,https://cir.nii.ac.jp/crid/1390290699726109568
母語話者教員および日本人教員に対するドイツ語学習者のコメント : 全国調査の結果に基づいて,2015-03-01,https://cir.nii.ac.jp/crid/1390572174809020544
第二言語としての日本語小論文評価における「いい内容」「いい構成」を探る : 評価観の共通点・相違点から,2015,https://cir.nii.ac.jp/crid/1390282680748659200
数学における非言語的思考,2014-03-31,https://cir.nii.ac.jp/crid/1050845762624365568
グルジェフの祈祷論 : 思想としての祈り、修行としての祈り,2014,https://cir.nii.ac.jp/crid/1390001205949940096
"10B02 論理的思考操作に関する言語の小学校低学年での指導の課題(保育・幼・小教育の実践と研究II,課題研究)",2013-11,https://cir.nii.ac.jp/crid/1520009409167683584
社会的実践としての読むこと : 教室における話し合い活動はどのように文学の読みを拓くのか(1)(自由研究発表),2013-05-18,https://cir.nii.ac.jp/crid/1390003825198945536
社会的実践としての読むこと : 教室における話し合い活動はどのように文学の読みを拓くのか(2)(自由研究発表),2013-05-18,https://cir.nii.ac.jp/crid/1390566775152367232
子育てにおける家庭言語の保持 ―カナダ・オンタリオ州トロントの移民家庭に対する 支援の実践―,2013-03-31,https://cir.nii.ac.jp/crid/1390290699865163904
小学校外国語活動での体験を踏まえた中学校英語の授業づくりに向けて : 言語の使用場面と言語の働きを繰り返し・発展的に扱う学習活動を行うための観点の抽出,2013-02-16,https://cir.nii.ac.jp/crid/1050282813464918912
「楽しさ」と「反復練習」は記憶強化に役立つか? : 外国語が身に付く学習方法について考える,2013,https://cir.nii.ac.jp/crid/1390001205323543936
推論の多義的解釈 ー認識的モダリティ意味記述のメタ言語ー,2012-03-31,https://cir.nii.ac.jp/crid/1050282813505475328
「満州国」における言語接触 : 新資料に見られる言語接触の実態,2012-03-28,https://cir.nii.ac.jp/crid/1050282677910385280
Students＇ perception of teachers＇ language use in an EFL classroom,2012-03-01,https://cir.nii.ac.jp/crid/1050564287377965696
日本人ドイツ語学習者のドイツ人母語話者のクラスルーム言語に関する見方 : 事例報告,2012-03-01,https://cir.nii.ac.jp/crid/1390009224855491584
在香港ネパール人コミュニティの言語選択 : 言語とアイデンティティ,2012,https://cir.nii.ac.jp/crid/1390001205771687040
Webアプリケーション開発のための分散JavaScript言語の提案,2011-03-02,https://cir.nii.ac.jp/crid/1050574047096428288
"ドイツ語か日本語か, 日本のドイツ語授業におけるクラスルーム言語の選択について",2011-03-01,https://cir.nii.ac.jp/crid/1390572174808871424
メモリ安全なC言語処理系Fail-Safe Cの実用プログラムへの適用のための改良,2011-01-07,https://cir.nii.ac.jp/crid/1050574047079321856
P2024　ムーブメント活動を用いて重症心身障害児の具体物と音声言語による活動の選択を目指した実践的研究,2011,https://cir.nii.ac.jp/crid/1390016748568671488
第二言語の使用経験が日本語話者の/r/と/l/の知覚に及ぼす影響,2011,https://cir.nii.ac.jp/crid/1390282679763752192
言語の使用場面と言語の働きを重視した英語の授業に必要な視点,2010-12-31,https://cir.nii.ac.jp/crid/1050014791007198080
ミドルトン劇における契約・誓約・ロアリング,2009-03-23,https://cir.nii.ac.jp/crid/1390853649826457728
高校英語教科書における「言語の使用場面」の扱い-学習指導要領(外国語)を中心に-,2009-03-18,https://cir.nii.ac.jp/crid/1050845763136281856
第二言語習得研究における社会的視点 : 認知的視点との比較と今後の展望(<特集>言語・コミュニケーションの学習・教育と社会言語科学-人間・文化・社会をキーワードとして-),2009,https://cir.nii.ac.jp/crid/1390001205773703680
在日留学生による第二・第三言語の使用における日本的文脈の役割,2008-03-31,https://cir.nii.ac.jp/crid/1390009224624577408
中等教育における五指学習の役割－Havｅに焦点をあてて-,2008-03-21,https://cir.nii.ac.jp/crid/1050282677652399488
会失語症の病巣,2008,https://cir.nii.ac.jp/crid/1390001205224245888
The Use of Assigned Roles for Developing Students Interactional Competence,2007-05-30,https://cir.nii.ac.jp/crid/1050001337720658304
イギリスにおける少数言語(ケルト語)と英語の二重表記 -ケルト系言語の使用状況と言語政策を中心に-,2007-02,https://cir.nii.ac.jp/crid/1390013352873257728
近代化社会で多様な言語の使用と自由平等の関係をどう処理すべきか-その方法を中心に-,2006,https://cir.nii.ac.jp/crid/1050282677722780672
中国・内モンゴル自治区巴林右旗(はりんうき)におけるモンゴル民族と漢民族の共存形態,2005-03-17,https://cir.nii.ac.jp/crid/1050854718487411200
近代化社会で多様な言語の使用と自由平等の関係をどう処理すべきか-そのモデルを中心に-,2005,https://cir.nii.ac.jp/crid/1050001202726357248
近代化社会で多様な言語の使用と自由平等の関係をどう処理すべきか-そのモデルを中心に-,2005,https://cir.nii.ac.jp/crid/1571698602442444928
当院及び連携施設における地域連携の現状と今後の課題（第1報）,2004,https://cir.nii.ac.jp/crid/1390282680541763072
ヨーロッパ統合時代のフランス・ドイツ・スイス国境地域（５）,2003,https://cir.nii.ac.jp/crid/1390282680669546752
データベースからみた論文使用言語の動向,2002,https://cir.nii.ac.jp/crid/1390001205626148608
グラフ情報の自然言語表現に関する研究,2000,https://cir.nii.ac.jp/crid/1390001204339039104
English as an lnternational Language : A Pre-reading Activity to Raise Students'  Awareness of Linguistic and Cultural Diversity,1999-10-01,https://cir.nii.ac.jp/crid/1050845762957097728
第1言語使用が第2言語の作文に及ぼす効果 : 文の流暢性と複雑さの観点から(平田悦朗先生退官記念号),1997-06-20,https://cir.nii.ac.jp/crid/1050282677928079360
日本語的な文法をもつLOGOの文法設計,1996-03-06,https://cir.nii.ac.jp/crid/1050574047076249728
機能言語理論によるデータ融合に関する一考察,1996,https://cir.nii.ac.jp/crid/1390001204337727872
簡易オーサリングツールMacLang4.5による自作CALL教材の開発,1996,https://cir.nii.ac.jp/crid/1390001205744807040
知的ファジィコンピューティング : ファジィ理論と機能言語理論の邂逅,1995,https://cir.nii.ac.jp/crid/1390282679361196160
"年長自閉的発達障害児, 発達障害者の音声模倣訓練 : 構音活動の特徴から(資料)",1994-03-31,https://cir.nii.ac.jp/crid/1390282763121675264
素朴な疑問：世界中（または日本中）で，種々のプログラミング言語の使用人口はどうなっているのだろうか，どのように変遷しているのか？,1994-02-15,https://cir.nii.ac.jp/crid/1050845762805450880
"発達障害児の授業場面における算数言語の使用(6) : triad transition matrix の""頻度""と""位相""による分析",1993-09-30,https://cir.nii.ac.jp/crid/1543950420047267840
ZによるACSEの記述,1993-03-01,https://cir.nii.ac.jp/crid/1050292572152265088
PB324 発達障害児の授業場面における算数言語の使用 (5) : triad transition matrixの伝達情報量と伝達効率との関係,1993,https://cir.nii.ac.jp/crid/1390001205793034368
"発達障害児の授業場面における算数言語の使用(3) : triad transition matrixの""位相""による分析",1992-09-14,https://cir.nii.ac.jp/crid/1541698620233577984
"1009 発達障害児の授業場面における算数言語の使用(2) : triad trasition matrixの""情報量""による分析(障害(2),口頭発表)",1992,https://cir.nii.ac.jp/crid/1390282680770688640
知能処理向きオブジェクト指向言語に必要な機能に関する一考察,1989-10-16,https://cir.nii.ac.jp/crid/1050292572118714752
C言語の使用法,1987-07-25,https://cir.nii.ac.jp/crid/1390572174792318720
オンラインデータベースと言語情報,1986,https://cir.nii.ac.jp/crid/1390001205473059712
分散処理システム記述用言語DPLとその実装法,1985-05-15,https://cir.nii.ac.jp/crid/1050845762820426880
ACOS1000プログラミング言語の使用手引（第1版）,1984-08,https://cir.nii.ac.jp/crid/1050282812678804480
"364 言語の使用水準と媒介過程(発達22,研究発表)",1983,https://cir.nii.ac.jp/crid/1390001205790781696
MLTG－マイクロプログラミング・ランゲージ・トランスレータ・ジェネレータ－：LALRバーサの一つの応用例,1979-01-15,https://cir.nii.ac.jp/crid/1050845762820601984
研究発表　夏目漱石の言語の使用から生ずる翻訳上の諸問題,1978-02-01,https://cir.nii.ac.jp/crid/1390009224823220224
LOREL言語の使用経験とその検討,1974-01-10,https://cir.nii.ac.jp/crid/1050294807642987392
原人に生理的早産はあったか（続報）,2022,https://cir.nii.ac.jp/crid/1390293666570322432
チンパンジー大腿骨頸部の骨密度と緻密骨厚の特徴,2017,https://cir.nii.ac.jp/crid/1390282680612848896
初期人類化石距骨関節面の3次元配向,2016,https://cir.nii.ac.jp/crid/1390282680610539136
フランス・アラゴ洞窟（La Caune de I'Arago）の発掘開始50周年記念（1964年から2014年）国際シンポジウム:「世界の鮮新世から更新世前・中期の化石人類」と「45万年前のハイデルベルグ原人（Homo heidelbergensis）、トータヴェル原人の位置」へ参加して,2015-03-31,https://cir.nii.ac.jp/crid/1390854882596841856
同位体で読み解く人類の進化と食生態(同位体の化学),2013,https://cir.nii.ac.jp/crid/1390001204306721280
原人に生理的早産はあったか？―ホモ・フロレシエンシスの頭骨化石からの示唆,2012,https://cir.nii.ac.jp/crid/1390001205633989888
大型類人猿の下顎犬歯形態（尖頭観と舌側面観）,2012,https://cir.nii.ac.jp/crid/1390001205634004224
曲面モデリングに基づく化石頭蓋組立システムの開発,2010,https://cir.nii.ac.jp/crid/1390001205653754880
化石人類の脳 : ネアンデルタール人と早期現代型新人の頭蓋エンドキャスト復元,2007-03-31,https://cir.nii.ac.jp/crid/1050001201680463744
飼育下のチンパンジー、オランウータンのワッジ採食および野生ニホンザルからのワッジ回収,2005,https://cir.nii.ac.jp/crid/1390001205634109184
チンパンジーの遺体を用いた第一中手骨内転運動のCT断層像観察,2005,https://cir.nii.ac.jp/crid/1390001288085940736
"薬学部情報活用基礎を担当した""IT 化石人類""のつぶやき",2004-09,https://cir.nii.ac.jp/crid/1390572174768345216
QUATERNARY GEOLOGY OF THE HOMINID FOSSIL BEARING FORMATIONS IN JAVA ジャワにおける化石人類についての文献紹介,2004-03,https://cir.nii.ac.jp/crid/1390853651569358592
熱帯アフリカ環境変動研究,2004,https://cir.nii.ac.jp/crid/1390282680670275072
現生人類の成立考,2003-03-31,https://cir.nii.ac.jp/crid/1050282812623763968
人類進化と新生代後期の環境変化　　中新世末から鮮新世の化石人類　　最近の動向,2002,https://cir.nii.ac.jp/crid/1390001204230728064
共存していた多様な化石人類：共存していた多様な化石人類：文・I. タッタソール／絵・J. H. マターンズ,2000-04,https://cir.nii.ac.jp/crid/1520573331278003456
シリア　デデリエ洞窟・中期旧石器の分類学的研究,1999-03,https://cir.nii.ac.jp/crid/1570291227661907072
日本人の起源にかかわる南西陸橋と人の移動,1998,https://cir.nii.ac.jp/crid/1390001206497233280
人を計る　人類学からみた計る,1996,https://cir.nii.ac.jp/crid/1390001204643744896
頬舌的に圧平された下顎小臼歯について,1991-06-29,https://cir.nii.ac.jp/crid/1050001202742188160
下顎第一大臼歯咬頭域面積のアロメトリーに関する人類学的研究,1985,https://cir.nii.ac.jp/crid/1390001204310819072
日本更新世人寛骨の非計量的特徴に関する研究,1985,https://cir.nii.ac.jp/crid/1390282679287122304
日本更新世人寛骨の形態学的研究,1982,https://cir.nii.ac.jp/crid/1390282679287368704
鼻中隔彎曲と外鼻の成立についてその化石人類学的考察,1977,https://cir.nii.ac.jp/crid/1390282679927987712
日本人歯牙のエナメル•ゾウゲ境についての形態学的研究,1973,https://cir.nii.ac.jp/crid/1390282679287976832
上顎大臼歯における遠心舌側咬頭の数量的分析,1970,https://cir.nii.ac.jp/crid/1390282679288344832
上顎乳犬歯の歯冠幅にみられる人種特徴,1966,https://cir.nii.ac.jp/crid/1390282679288285696
下顎第2乳臼歯におけるいわゆる第7咬頭について,1965,https://cir.nii.ac.jp/crid/1390001204310241152
下顎大臼歯におけるDeflecting Wrinkleについて,1964,https://cir.nii.ac.jp/crid/1390001204309828224
尺度の起源に関する若干の考察 : 生活空間の把握と表現,1964,https://cir.nii.ac.jp/crid/1390853649850647168
化石人類の話（2）,1951-09-01,https://cir.nii.ac.jp/crid/1390011340296681216
化石人類の話,1951-04-01,https://cir.nii.ac.jp/crid/1390855765226816384
東亜に於ける化石人類,1935-06-01,https://cir.nii.ac.jp/crid/1390292859777197568
新發見の化石人類,1932,https://cir.nii.ac.jp/crid/1390001204235345024
珍しい二化石人類,1931,https://cir.nii.ac.jp/crid/1390001204235270016
化石人類とその文化,1930,https://cir.nii.ac.jp/crid/1390001204236085632
再び支那の化石人類シナンスロパスに就いて,1930,https://cir.nii.ac.jp/crid/1390282679212929792
化石人類と猿類的構造,1916-07-28,https://cir.nii.ac.jp/crid/1543105995158824064
上顎犬歯形態からみた人類進化,2022,https://cir.nii.ac.jp/crid/1390855455476789760
サルからヒトへの進化―二足歩行の前段階,2014,https://cir.nii.ac.jp/crid/1390282679447221248
人間家族の起源：類人猿社会との比較から,2013,https://cir.nii.ac.jp/crid/1050845760782137216
中国南部の前期更新世の洞窟堆積物から出土したギガントピテクス大臼歯のエナメル分布形状分析,2012,https://cir.nii.ac.jp/crid/1390282680610698496
Open Japanese（ニホン英語）をデザインする,2011-11-30,https://cir.nii.ac.jp/crid/1050001337615203584
人とチンパンジーの間,2011,https://cir.nii.ac.jp/crid/1390282680611463552
知は地球を救う 2.人類の進化700 万年 - 予断に捉われないことの難しさ -,2009-03-10,https://cir.nii.ac.jp/crid/1050001337976548224
猿人ルーシーの子ども：猿人ルーシーの子ども：K. ウォン,2007-03,https://cir.nii.ac.jp/crid/1522825129745305216
ハリウッド探検/冒険映画のイデオロギー的変容 : 『類猿人ターザン』の<アフリカ>,2006-03-15,https://cir.nii.ac.jp/crid/1050001338912081664
森の猿人,2004-03-25,https://cir.nii.ac.jp/crid/1390572172715223552
「サルの進化と人類の起源：サルからヒトへ」,2004,https://cir.nii.ac.jp/crid/1390001205634320000
プロジェクトＮ：ケニア後期中新世の古人類学的調査,2004,https://cir.nii.ac.jp/crid/1390282680610451072
現生人類の成立考,2003-03-31,https://cir.nii.ac.jp/crid/1050282812623763968
私が和達先生に最後にお会いした時(和達清夫名誉会員を偲んで),1995-07-31,https://cir.nii.ac.jp/crid/1543105995114440576
初期人類系統論の現状,1994,https://cir.nii.ac.jp/crid/1390282679286363648
「類猿人」の登場,1989-07-20,https://cir.nii.ac.jp/crid/1050564287506117504
「類猿人」の登場,1989-07-20,https://cir.nii.ac.jp/crid/1571417127641157504
力学的連成系を形成する湾内のセイシュ,1987,https://cir.nii.ac.jp/crid/1390282681542472192
猿人の「あし」とロコモーション(<特集>「足と脚」),1983,https://cir.nii.ac.jp/crid/1390282679666025984
昭和50年度技術士本試験　情報処理部門　情報管理　問題と解説,1976,https://cir.nii.ac.jp/crid/1390282680484688128
日本沿岸各地の平均海面について,1975,https://cir.nii.ac.jp/crid/1390001206564880256
猿人間ラモーの甥 : 《模倣》のテーマをめぐって,1975,https://cir.nii.ac.jp/crid/1390282680797173120
沿 岸 海 洋 学 を 顧 み て,1972,https://cir.nii.ac.jp/crid/1390002184873913472
藍田猿人の発見と論争,1969,https://cir.nii.ac.jp/crid/1390001204229630720
海峡 や 水道 に お け る 流動 そ の 他 の 現象,1968,https://cir.nii.ac.jp/crid/1390283659850940416
台風による御前岩と五島灘の波浪の計算,1958,https://cir.nii.ac.jp/crid/1390282681542294656
明石海峽の潮汐と潮流 (第2報),1957,https://cir.nii.ac.jp/crid/1390282681542204928
原子エネルギーと海面の振動,1955,https://cir.nii.ac.jp/crid/1390001206565547008
最近における海の波研究の概観,1954,https://cir.nii.ac.jp/crid/1390282680412276224
