表現主義と気韻生動 : 北清事変から大正末年に至る橋本関雪の軌跡と京都支那学の周辺,2015-03-31,https://cir.nii.ac.jp/crid/1390009224770827136
第6回東アジア考古学会 日本列島の前期旧石器時代研究セッション参加記,2015-03-31,https://cir.nii.ac.jp/crid/1390010457689125760
細石刃の消滅に伴う彫刻刀形石器の機能変化 北海道帯広市の旧石器時代遺跡群の比較分析から,2015-03-31,https://cir.nii.ac.jp/crid/1390291932665845120
静岡県広野北遺跡における旧石器時代文化層の再検討,2015-03-29,https://cir.nii.ac.jp/crid/1390290699600352640
神奈川県における旧石器時代の遺物分布（その8）ーL3層～B5層ー,2015-03-27,https://cir.nii.ac.jp/crid/1390853829701225984
群馬県鶴ヶ谷東遺跡発掘調査の研究報告 -日本前期旧石器時代の研究-,2015-03-26,https://cir.nii.ac.jp/crid/1050566774891760384
考古学資料の3次元計測、応用と可能性（1） 府中市武蔵野台遺跡出土後期旧石器時代石斧（その1）,2015-03-19,https://cir.nii.ac.jp/crid/1390292815261948672
クレズウェル・クラッグスの洞窟壁画 : ウラン系列年代測定法の問題,2015-03-13,https://cir.nii.ac.jp/crid/1390853649775857024
旧石器時代・縄文時代草創期遺跡の調査・研究,2015-03,https://cir.nii.ac.jp/crid/1390573407643883008
大和市域を中心とした旧石器時代の変遷について 上草柳遺跡群大和配水池内遺跡の調査事例を基に,2015-01-30,https://cir.nii.ac.jp/crid/1390011340287670528
更新世末の九州地方における先史狩猟採集民の居住形態,2015,https://cir.nii.ac.jp/crid/1390001206495693952
上部旧石器時代における中部高地黒曜石原産地の土地利用変化,2015,https://cir.nii.ac.jp/crid/1390001206495694976
山形県寒河江市高瀬山遺跡における石器空間分布の攪乱要因,2015,https://cir.nii.ac.jp/crid/1390001206497470592
特集号「更新世・完新世の資源環境と人類」の趣旨,2015,https://cir.nii.ac.jp/crid/1390282681472402688
関東甲信越地方における後期旧石器時代石器群の生態ニッチモデリング,2015,https://cir.nii.ac.jp/crid/1390282681472406016
黒ボク土層の生成史：人為生態系の観点からの試論,2015,https://cir.nii.ac.jp/crid/1390282681472420736
九州島における後期旧石器時代後半の定住化のプロセス 九州旧石器時代研究の展望,2014-09-13,https://cir.nii.ac.jp/crid/1390011384813097344
九州旧石器時代研究の展望 「研究会」小史と後期旧石器時代の地域性,2014-09-13,https://cir.nii.ac.jp/crid/1390292859777083008
九州地方における旧石器時代石器群と遺跡群について,2014-09-13,https://cir.nii.ac.jp/crid/1390292859789818240
四国地方における旧石器時代遺跡の展開とその特徴,2014-09-13,https://cir.nii.ac.jp/crid/1390574334779324160
関東・中部地方における旧石器時代遺跡群の展開,2014-09-13,https://cir.nii.ac.jp/crid/1390574334792108928
別府湾沿岸地域における旧石器時代資料（その7） 角田司郎氏採集資料より,2014-09-13,https://cir.nii.ac.jp/crid/1390855809768810240
中国地方における旧石器時代遺跡群の展開,2014-09-13,https://cir.nii.ac.jp/crid/1390855809768811648
和歌山県における旧石器時代研究の歩み,2014-08-31,https://cir.nii.ac.jp/crid/1390010457643948288
鹿児島県の考古学動向 平成25年度（2013.4から2014.3） 旧石器時代,2014-07-19,https://cir.nii.ac.jp/crid/1390291932665964544
旧石器時代の住居構造の認識・同定方法について シベリア地域ウイII遺跡からの検証,2014-06-15,https://cir.nii.ac.jp/crid/1390010457710437888
愛媛県池ノ岡遺跡の後期旧石器時代遺物 木村剛朗採集資料の紹介,2014-05-31,https://cir.nii.ac.jp/crid/1390009226651150464
2013年東京の考古学動向 旧石器時代,2014-05-18,https://cir.nii.ac.jp/crid/1390855765216835072
小・中学校段階における歴史学習と考古学の役割 日本列島における旧石器時代の取り扱いについて考える,2014-05-17,https://cir.nii.ac.jp/crid/1390011340286309248
旧石器時代における黒曜石原産地遺跡の研究 鷹山遺跡群第I遺跡S地点における黒曜石の入手とその構成,2014-05-17,https://cir.nii.ac.jp/crid/1390292815286688640
日本旧石器学会 第11回講演・研究発表・シンポジウム 「旧石器時代の年代と広域編年対比」,2014-05-15,https://cir.nii.ac.jp/crid/1390010457710552960
北海道における旧石器時代から縄文時代草創期に相当する石器群の年代と編年,2014-05-15,https://cir.nii.ac.jp/crid/1390291932643587328
東北地方における旧石器時代の編年と年代,2014-05-15,https://cir.nii.ac.jp/crid/1390291932666023424
後期旧石器時代の広域編年対比にむけて ¹⁴C年代測定の高精度化と較正年代による年代観の変化,2014-05-15,https://cir.nii.ac.jp/crid/1390291932687265536
関東地方における旧石器時代の年代と編年,2014-05-15,https://cir.nii.ac.jp/crid/1390573407620300800
書評 山岡拓也著『後期旧石器時代前半期石器群の研究 南関東武蔵野台地からの展望』,2014-05-15,https://cir.nii.ac.jp/crid/1390854882597017088
近畿・中四国における旧石器時代の年代と編年,2014-05-15,https://cir.nii.ac.jp/crid/1390854882640690816
2012年度の日本考古学界 日本考古学研究の動向 旧石器時代研究の動向,2014-05-15,https://cir.nii.ac.jp/crid/1390855765215921536
相模野台地における後期旧石器時代前半期の剥片剥離技術,2014-05-14,https://cir.nii.ac.jp/crid/1390011384824833664
追平B遺跡出土石器群の再検討-愛鷹山麓における後期旧石器時代初頭の石器石材利用-,2014-03-31,https://cir.nii.ac.jp/crid/1050576059522759680
石岡市内出土旧石器時代資料の観察・分析報告,2014-03-31,https://cir.nii.ac.jp/crid/1390290699754873600
明治大学校地内遺跡整理作業経過報告 後期旧石器時代,2014-03-31,https://cir.nii.ac.jp/crid/1390292815287938944
旧石器時代・縄文時代草創期における遺跡分布の変遷 : 遺跡データベースとGIS を利用して,2014-03-29,https://cir.nii.ac.jp/crid/1390572174577067008
旧石器時代～縄文時代草創期の原の辻遺跡,2014-03-28,https://cir.nii.ac.jp/crid/1390574290248627072
神奈川県における旧石器時代の遺物分布（その7）ーB2層（まとめ）ー,2014-03-20,https://cir.nii.ac.jp/crid/1390009404771088000
旧石器時代における石器石材原産地の開発-槍先形尖頭器文化と中部高地黒耀石原産地遺跡の形成過程-,2014-03-01,https://cir.nii.ac.jp/crid/1050857534501271168
多摩丘陵、相模野地域における後期旧石器時代終末から縄文時代初頭の様相,2014-03,https://cir.nii.ac.jp/crid/1390009225467806592
日本旧石器時代の起源と論争 前期旧石器時代存否論争と珪岩製旧石器,2014-02-01,https://cir.nii.ac.jp/crid/1390010457644026368
東アジアの旧石器時代 韓半島の旧石器文化,2014-02-01,https://cir.nii.ac.jp/crid/1390010457689557504
日本旧石器時代の文化と系譜 槍先形尖頭器文化の発達,2014-02-01,https://cir.nii.ac.jp/crid/1390291932620734080
東アジアの旧石器時代 中国大陸の旧石器時代,2014-02-01,https://cir.nii.ac.jp/crid/1390291932620734976
旧石器時代人の暮らし 旧石器時代の自然と環境 人びとを取りまく景観とその変化,2014-02-01,https://cir.nii.ac.jp/crid/1390291932643839104
日本旧石器時代の起源と論争 関東ロームと旧石器時代に古さ,2014-02-01,https://cir.nii.ac.jp/crid/1390291932687472256
日本旧石器時代の文化と系譜 ナイフ形石器の出現,2014-02-01,https://cir.nii.ac.jp/crid/1390573407620540416
黒曜石と朝鮮半島の旧石器時代,2014-02-01,https://cir.nii.ac.jp/crid/1390573407642979584
旧石器時代人の暮らし 石器石材原産地の開発,2014-02-01,https://cir.nii.ac.jp/crid/1390573407642980224
日本旧石器時代の起源と論争 日本列島最古の石器群,2014-02-01,https://cir.nii.ac.jp/crid/1390573407642980864
日本旧石器時代の文化と系譜 北の細石器文化,2014-02-01,https://cir.nii.ac.jp/crid/1390573407664183680
東アジアの旧石器時代 シベリアの旧石器時代,2014-02-01,https://cir.nii.ac.jp/crid/1390573407664184960
旧石器時代人の暮らし 後期旧石器時代の生業,2014-02-01,https://cir.nii.ac.jp/crid/1390854882574155776
東アジアの旧石器時代 現生人類の拡散と東アジアの旧石器,2014-02-01,https://cir.nii.ac.jp/crid/1390854882597251200
日本列島の旧石器時代史,2014-02-01,https://cir.nii.ac.jp/crid/1390854882597251968
日本旧石器時代の文化と系譜 南の細石器文化,2014-02-01,https://cir.nii.ac.jp/crid/1390854882619698176
旧石器時代人の暮らし 岩宿時代のイエとムラ,2014-02-01,https://cir.nii.ac.jp/crid/1390854882640901376
HLA遺伝子多型からみた日本人集団の混合的起源,2014,https://cir.nii.ac.jp/crid/1390001205481806720
考古遺跡からみた氾濫原の微地形と災害,2014,https://cir.nii.ac.jp/crid/1390001205694836224
京都盆地における姶良Tn火山灰の堆積状況,2014,https://cir.nii.ac.jp/crid/1390282680671448192
研究発表「備北地域の旧石器時代遺跡」,2013-12,https://cir.nii.ac.jp/crid/1390009226644926464
基調講演Ⅰ「旧石器時代の環境とくらし」,2013-12,https://cir.nii.ac.jp/crid/1390853651569089536
別府湾沿岸地域における旧石器時代資料（その6） 角田司郎氏採集資料より,2013-11-30,https://cir.nii.ac.jp/crid/1390574334766520064
佐世保市板山遺跡 後期旧石器時代資料,2013-11-30,https://cir.nii.ac.jp/crid/1390855809768813568
【書評論文】安斎正人著『気候変動の考古学』(2012年),2013-09-30,https://cir.nii.ac.jp/crid/1050288547192234368
書評 山岡拓也著 後期旧石器時代前半期石器群の研究 南関東武蔵台地からの展望,2013-08-01,https://cir.nii.ac.jp/crid/1390573407643006336
鹿児島県の考古学動向 平成24年度（2012.4から2013.3） 旧石器時代,2013-07-13,https://cir.nii.ac.jp/crid/1390291932665968896
2012年東京の考古学動向 旧石器時代,2013-05-26,https://cir.nii.ac.jp/crid/1390574290263950208
九州における後期旧石器時代の遺跡分布とその変化,2013-05-20,https://cir.nii.ac.jp/crid/1390010457689305984
日本旧石器学会 第10回講演・研究発表シンポジウム 「旧石器時代遺跡・立地・分布研究の新展開」,2013-05-20,https://cir.nii.ac.jp/crid/1390291932687266304
2011年度の日本考古学界 日本考古学研究の動向 旧石器時代研究の動向,2013-05-20,https://cir.nii.ac.jp/crid/1390292815286280832
北海道十勝平野の後期旧石器時代遺跡の地質編年:新たなAMS放射性炭素年代の追加とその意義,2013-05-20,https://cir.nii.ac.jp/crid/1390573407620301696
北海道の後期旧石器時代における黒曜石産地の開発と黒曜石の流通,2013-05-20,https://cir.nii.ac.jp/crid/1390854882619439744
アラビア半島南東部における石器時代遺跡の遺りやすさに関する地考古学的考察,2013-05,https://cir.nii.ac.jp/crid/1050011097150041088
品野盆地周辺の後期旧石器時代から縄文時代草創期の石器群,2013-03-31,https://cir.nii.ac.jp/crid/1390853650396647936
[論文] 弥生人の成立と展開Ⅱ : 韓半島新石器時代人との遺伝的な関係を中心に,2023-09-29,https://cir.nii.ac.jp/crid/1050298433142754304
女神の神話学再考 : とくに太陽女神／王権女神について,2023-03-17,https://cir.nii.ac.jp/crid/1050577818267897600
ヨーロッパハイマツ帯の景観,2023,https://cir.nii.ac.jp/crid/1390858619526116352
<研究ノート>稲作の天水農耕地帯への波及 --中国の新石器時代から古代王朝までを概観して--,2022-07-25,https://cir.nii.ac.jp/crid/1390857822163895424
<論文>西アジア先土器新石器時代における「特殊建物（公共建造物）」,2022-03,https://cir.nii.ac.jp/crid/1050295679779011456
[論文] 「初期青銅器弥生時代」の提唱 : 鉄器出現以前の弥生時代,2022-02-25,https://cir.nii.ac.jp/crid/1050858608274691712
骨考古学による中国文明起源の解明にむけて,2022,https://cir.nii.ac.jp/crid/1390012191593614720
アムール川下流域における新石器文化の年代研究,2021-12-06,https://cir.nii.ac.jp/crid/1390858054369584384
古代中国における鳥信仰―新石器時代における「鳥と円形」の象徴的意味の探究―,2021-03-31,https://cir.nii.ac.jp/crid/1050569181293002112
"RESTORATION OF A UNIQUE NEOLITHIC CLAY FEMALE FIGURINE FROM TELL SEKER AL-AHEIMAR, NORTHEAST SYRIA",2021-03-31,https://cir.nii.ac.jp/crid/1050571339768679808
ユダヤ自治州新石器時代ビジャン4遺跡出土の新資料 : 2017・2018年度試掘調査出土遺物の分析結果報告,2021-03-29,https://cir.nii.ac.jp/crid/1390290700496138624
新石器時代における農耕民-狩猟採集民の2者選-モデル (第16回 生物数学の理論とその応用 -生命現象の定量的理解に向けて-),2020-07,https://cir.nii.ac.jp/crid/1050568617144795008
遼西地区における新石器時代の社会組織について,2020-03,https://cir.nii.ac.jp/crid/1050850889246316032
アゼルバイジャンにおけるヨモギ属（Artemisia spp.）利用史,2020,https://cir.nii.ac.jp/crid/1390855656055814528
シリア・土器新石器時代出土の青色ビーズにおける人類最初の人造青色着色技術の解明,2019-01-25,https://cir.nii.ac.jp/crid/1391975831236284160
〈考古学部会〉ロシア極東における新石器時代の石器使用痕研究の実践と課題,2018-10-30,https://cir.nii.ac.jp/crid/1050008940654735744
西アジア新石器時代の社会 交易ネットワークの形成 新石器時代における黒曜石・海産貝類の流通,2017-11-01,https://cir.nii.ac.jp/crid/1390291932643805568
西アジア新石器時代の社会 揺らぐ新石器革命論 農耕・牧畜の起源と新石器時代の社会,2017-11-01,https://cir.nii.ac.jp/crid/1390573407597419136
西アジア新石器時代の社会 西アジアにおける動物と植物のドメスティケーション（家畜化・栽培化）,2017-11-01,https://cir.nii.ac.jp/crid/1390854882619662848
THE BURIAL OF NEOLITHIC BLADE PRODUCER,2017-03-31,https://cir.nii.ac.jp/crid/1050564287671060480
柳田國男旧蔵考古資料における石器の使用痕分析,2017-03-31,https://cir.nii.ac.jp/crid/1390009224089837440
<研究ノート>アナトリア新石器時代の調理用焼成遺構について,2017-03,https://cir.nii.ac.jp/crid/1050282677525493504
台湾の巨石文化について,2016-11-26,https://cir.nii.ac.jp/crid/1390292859777052800
書評 久保田慎二著 中国新石器時代の変遷と交流 環太行山脈地区文化圏の成立とその背景,2016-05-01,https://cir.nii.ac.jp/crid/1390010457710744448
012 あとがき,2016-03-31,https://cir.nii.ac.jp/crid/1390009225469146880
011 第2部 人骨骨格図譜（改訂版）,2016-03-31,https://cir.nii.ac.jp/crid/1390009225469147776
006 第1部 Ⅳ. 田螺山遺跡における鳥類利用,2016-03-31,https://cir.nii.ac.jp/crid/1390009225469148800
005 第1部 Ⅲ. 田螺山遺跡から出土したカメ類について,2016-03-31,https://cir.nii.ac.jp/crid/1390009225469149824
004 第1部 Ⅱ.田螺山遺跡から出土した魚類遺存体（初報）,2016-03-31,https://cir.nii.ac.jp/crid/1390009225469150720
003 第1部 Ⅰ.共同調査の経緯と概要,2016-03-31,https://cir.nii.ac.jp/crid/1390009225469151616
001 表紙、目次、例言、写真図版、奥付、背表紙,2016-03-31,https://cir.nii.ac.jp/crid/1390009225469152256
010 第1部 Ⅷ. 長江下流域における新石器時代のヒトと動物の炭素・窒素同位体分析,2016-03-31,https://cir.nii.ac.jp/crid/1390290700445849600
007 第1部 Ⅴ.良渚遺跡群美人地遺跡出土の動物遺存体（初報）,2016-03-31,https://cir.nii.ac.jp/crid/1390290700445850624
002 第1部 《家畜（禽）起源考古学日中合作研究报告》序,2016-03-31,https://cir.nii.ac.jp/crid/1390290700445854208
009 第1部 Ⅶ.田螺山遺跡出土木柱の放射性炭素年代,2016-03-31,https://cir.nii.ac.jp/crid/1390853650399274112
008 第1部 Ⅵ.良渚遺跡群美人地遺跡から出土した人骨の形態と特徴,2016-03-31,https://cir.nii.ac.jp/crid/1390853650399275392
長崎県立美術博物館旧蔵釜山「牧ノ島貝塚」出土新石器時代土器,2016-03-31,https://cir.nii.ac.jp/crid/1390855765217412864
[研究ノート] 韓国蔚山市細竹遺跡における新石器時代の土器付着炭化物の分析,2016-01-31,https://cir.nii.ac.jp/crid/1390290699066552320
西アジアの初期の土器にみられる突帯,2015-09-30,https://cir.nii.ac.jp/crid/1390001288073271808
「石犂」の使用痕分析 : 良渚文化における石製農具の機能 (5),2015-05-20,https://cir.nii.ac.jp/crid/1390014104844662400
水と考古学 : 長江下流域と周辺の井戸,2015-03-31,https://cir.nii.ac.jp/crid/1050855676756383744
サハリン新石器時代前期スラブナヤ５遺跡の発掘調査報告,2015-03-29,https://cir.nii.ac.jp/crid/1390009224623646976
変性剤濃度勾配ゲル電気泳動法を用いた、トルコ・イェニカプ遺跡から発掘された新石器時代の出土樹木中に存在する微生物群の菌叢解析,2015-03-26,https://cir.nii.ac.jp/crid/1390009224847020032
日本海をめぐる新石器時代の年代対比のために-水多里貝塚出土土器付着物の炭素14年代測定-,2015-03-13,https://cir.nii.ac.jp/crid/1050001202706874496
脱穀・風選実験と現生果実の形態比較に基づく アワ土器圧痕の母集団の推定,2015,https://cir.nii.ac.jp/crid/1390287373996602368
「破土器」の使用痕分析 : 良渚文化における石製農具の機能 (4),2014-10-10,https://cir.nii.ac.jp/crid/1390014104844672512
<研究ノート>西アジアの石像 : 新石器時代,2014-09-30,https://cir.nii.ac.jp/crid/1390009224851039360
縄文時代のウルシとその起源,2014-07-31,https://cir.nii.ac.jp/crid/1390009224089262080
韓国櫛文土器文化の土器圧痕と初期農耕,2014-07-31,https://cir.nii.ac.jp/crid/1390009224089266432
中国新石器時代の太行山脈東側地区における土器編年と地域間関係,2014-07-20,https://cir.nii.ac.jp/crid/1390292859789607296
植物遺存体資料からみた、西アジアとその周辺の新石器時代における穀類（皮性/裸性）の選択,2014-07-14,https://cir.nii.ac.jp/crid/1390574334791841536
研究発表要旨ポスターセッション オシノヴァヤレーチカ10遺跡における2013年調査の成果と課題 アムール川下流域の初期新石器時代オシポフカ文化の研究,2014-05-17,https://cir.nii.ac.jp/crid/1390292815286683648
山東の新石器時代における近年の考古学的発見と研究,2014-03-28,https://cir.nii.ac.jp/crid/1390009224665181696
講演 山東の新石器時代における近年の考古学的発見と研究,2014-03-28,https://cir.nii.ac.jp/crid/1390291932644219776
日韓における穀物農耕の起源 植物圧痕分析（韓国編） 韓国陝川鳳渓里遺跡における新石器時代後期の植物圧痕,2014-03-26,https://cir.nii.ac.jp/crid/1390009226995980416
日韓における穀物農耕の起源 植物圧痕分析（韓国編） 韓国金泉智佐里遺跡における新石器時代後期の圧痕調査,2014-03-26,https://cir.nii.ac.jp/crid/1390290701972697856
日韓における穀物農耕の起源 植物圧痕分析（韓国編） 韓国金泉松竹里遺跡における新石器時代中期の植物圧痕,2014-03-26,https://cir.nii.ac.jp/crid/1390290701975097600
日韓における穀物農耕の起源 植物圧痕分析（韓国編） 韓国安山大阜北洞遺跡における新石器時代中期の植物圧痕,2014-03-26,https://cir.nii.ac.jp/crid/1390572176954108416
日韓における穀物農耕の起源 植物圧痕分析（韓国編） 韓国華城石橋里遺跡における新石器時代中期の植物圧痕,2014-03-26,https://cir.nii.ac.jp/crid/1390853651928512000
日韓における穀物農耕の起源 論考編 韓国新石器時代・青銅器時代の農耕関連石器の使用痕分析,2014-03-26,https://cir.nii.ac.jp/crid/1390853651930881792
中国東北の農業開発,2014,https://cir.nii.ac.jp/crid/1390001205694380288
中国新石器時代早期の墓に見られる中国化現象,2013-12-25,https://cir.nii.ac.jp/crid/1390853649729470080
境界付近における関係の実像 極東臨海・島嶼世界の新石器時代の区分について,2013-11-01,https://cir.nii.ac.jp/crid/1390010457689559936
日韓新石器時代研究会,2013-11-01,https://cir.nii.ac.jp/crid/1390854882640902784
【書評論文】安斎正人著『気候変動の考古学』(2012年),2013-09-30,https://cir.nii.ac.jp/crid/1050288547192234368
ヒトの誕生から新石器時代化現象まで アンリ・ドゥ・リュムレイの2冊の著書,2013-09-30,https://cir.nii.ac.jp/crid/1390010457666713344
英米の文学作品に見られる社会思想史的トイレット考,2013-09-20,https://cir.nii.ac.jp/crid/1050001202706754816
アラビア半島南東部における石器時代遺跡の遺りやすさに関する地考古学的考察,2013-05,https://cir.nii.ac.jp/crid/1050011097150041088
西アジア新石器時代におけるPPN式対向剥離石刃製作技術の研究,2013-05-01,https://cir.nii.ac.jp/crid/1390577054798081792
地中海地域の黒曜石研究概要,2013-03-31,https://cir.nii.ac.jp/crid/1050013109569358208
中国新石器時代の玦の研究と展望 出土玦の概念と今後の課題,2013-03-31,https://cir.nii.ac.jp/crid/1390573407663538944
七社宮遺跡出土双頭熊形石製品と紅山文化の小玉熊考 中国新石器時代の熊形玉製品との接点を探る,2013-03-31,https://cir.nii.ac.jp/crid/1390854882640250624
窑火长红 : 浙江古代瓷业概况,2013-03-29,https://cir.nii.ac.jp/crid/1390009224665185536
テル・エル・ケルク遺跡における土器新石器時代小児埋葬儀礼,2013-03,https://cir.nii.ac.jp/crid/1050001202548035712
頭蓋の形態小変異からみたアイヌとその隣人たち,2013,https://cir.nii.ac.jp/crid/1390001204469747200
イラン新石器時代タペ・サンギチャハマック遺跡の土器の組織と構成鉱物,2013,https://cir.nii.ac.jp/crid/1390001205737947776
中国新石器時代末期における鼎から鬲への煮沸器転換に関する実験考古学的研究 : 山西省西南部を中心に,2012-03-25,https://cir.nii.ac.jp/crid/1050282677447180032
<研究ノート> 西アジア先土器新石器時代研究の動向,2012-03,https://cir.nii.ac.jp/crid/1050282677524553856
初期完新世湿潤期とマラリア,2012,https://cir.nii.ac.jp/crid/1390001205342982656
ベトナムの考古文化(5) -新石器時代後期-,2011-10-01,https://cir.nii.ac.jp/crid/1050001202932288896
神話素システムと2コンパートメント準平衡理論 : 旧石器時代から新石器時代への精神の飛躍に関するシステム論序説,2011-03-31,https://cir.nii.ac.jp/crid/1050564288195999744
ベトナムの考古文化(4) -新石器時代中期-,2011-03-01,https://cir.nii.ac.jp/crid/1050001202933393920
新石器時代晩期から鉄器時代にかけたフィリピン北部と台湾南部の土器の関連性について 特に矢羽根状刻み目紋土器について,2011-02-28,https://cir.nii.ac.jp/crid/1390291932620020608
コイ科魚類咽頭歯遺存体から見える先史時代の漁撈と稲作との関係に関する一考察（Ⅰ. 水田の中の“自然”）,2011-01-31,https://cir.nii.ac.jp/crid/1390572174043060864
「耘田器」の使用痕分析 : 良渚文化における石製農具の機能,2011-01-01,https://cir.nii.ac.jp/crid/1050845760855034496
ヨルダン南部，ワディ・アブ・トレイハ遺跡における新石器時代ダム遺構の周辺環境,2010-12-25,https://cir.nii.ac.jp/crid/1390009224496044928
賈湖遺跡墓群の研究 : 中国新石器時代早期社会に見られる格差,2010-12-24,https://cir.nii.ac.jp/crid/1390853649729444352
先史時代研究の新潮流 日韓新石器時代土器文化交流,2010-11-01,https://cir.nii.ac.jp/crid/1390291932620761344
先史時代研究の新潮流 韓国新石器時代の分離・粉砕具と縄文文化,2010-11-01,https://cir.nii.ac.jp/crid/1390573407643026304
ベトナムの考古文化(3) -新石器時代前期-,2010-10-01,https://cir.nii.ac.jp/crid/1050001202934496768
青海高原新石器時代の集落と墓地の研究,2010-09-30,https://cir.nii.ac.jp/crid/1390290699843362048
西アジア先史考古学の課題 : イランの調査から,2010-03,https://cir.nii.ac.jp/crid/1390572174358016256
台湾・墾丁寮遺跡および烏山頭遺跡出土の新石器時代人骨,2010-03,https://cir.nii.ac.jp/crid/1390855765225107072
ベトナム北部，紅河デルタ平野における完新世中期の自然堤防と放棄河道,2010,https://cir.nii.ac.jp/crid/1390001205693884928
中国新石器時代の勾玉,2009-03-31,https://cir.nii.ac.jp/crid/1390291932643226368
石器のマテリアリティ,2009,https://cir.nii.ac.jp/crid/1390001205342010240
